{
  "contract": "1.0",
  "publisher_id": "example-aid-app",
  "created_at": "2026-08-18T14:00:00Z",
  "updated_at": "2026-08-18T17:30:00Z",
  "stack": {
    "language": "typescript",
    "framework": "nextjs",
    "hosting": "vercel",
    "guide": "implement/stacks/nextjs-supabase.md"
  },
  "target_level": "L2",
  "methodology": {
    "id": "deepworkplan",
    "name": "DeepWorkPlan",
    "entry_command": "/dwp-execute cabuya_adoption",
    "artifacts_path": ".dwp/plans/",
    "source": "dwp"
  },
  "pii_decision": {
    "decided_by": "human",
    "decided_at": "2026-08-18T15:10:00Z",
    "approved_columns": ["direccion", "horario"],
    "rejected_columns": ["contacto", "responsable"],
    "notes": "contacto holds mixed org and volunteer values; excluded entirely. Contact reaches users through public_url."
  },
  "steps": [
    { "id": "read_and_detect", "status": "done", "completed_at": "2026-08-18T14:20:00Z", "validation": "passed" },
    { "id": "map", "status": "done", "completed_at": "2026-08-18T14:50:00Z", "validation": "human" },
    { "id": "pii_gate", "status": "done", "completed_at": "2026-08-18T15:10:00Z", "validation": "human" },
    { "id": "serialize", "status": "done", "completed_at": "2026-08-18T16:20:00Z", "validation": "passed" },
    { "id": "serve", "status": "done", "completed_at": "2026-08-18T16:50:00Z", "validation": "passed" },
    { "id": "validate_loop", "status": "done", "completed_at": "2026-08-18T17:30:00Z", "validation": "passed" }
  ],
  "last_measured": {
    "mode": "online",
    "target": "https://app.example.invalid/.well-known/cabuya.json",
    "level": "L2",
    "report_digest": "sha256:9f2c1a7e0b3d5c8a6e4f2b1d9c7a5e3f1b8d6c4a2e0f9b7d5c3a1e8f6b4d2c0a",
    "measured_at": "2026-08-18T17:30:00Z",
    "validator_version": "0.1.4"
  }
}
